117	HTML,HyperText Markup Language	웹 페이지 표시를 위해 개발된 지배적인 마크업 언어다. 또한, 제목, 단락, 목록 등과 같은 본문을 위한 구조적 의미를 나타내는 것뿐만 아니라 링크, 인용과 그 밖의 항목으로 구조적 문서를 만들 수 있는 방법을 제공한다.
118	소프트웨어 생명주기,SDLC,Software Development Life Cycle	시스템의 요구분석부터 유지보수까지 전 공정을 체계화한 절차
119	폭포수 모델	소프트웨어 개발의 전 과정을 나누어 체계적이고 순차적으로 접근하는 소프트웨어 개발 생명주기 모델
120	프로토타이핑 모델,Prototyping Model	사용자 요구사항을 충분히 분석할 목적으로 시스템의 중요 일부분을 우선 구현 후, 다시 요구사항을 반영하는 과정을 반복하는 개발 모델
121	나선형 모델,Spiral Model	시스템 개발시 위험을 최소화 하기 위해 점진적으로 완벽한 시스템으로 개발해 나가는 모델
122	구조적 방법론	정형화된 분석 절차에 따라 사용자 요구사항을 파악하여 문서화하는 체계적인 방법으로 비즈니스 프로세스 자동화를 목표로 하고 있으며, 프로세스 중심의 개발 방법
123	객체지향 방법론	‘객체’라는 기본 단위로 시스템을 분석 및 설계하는 방법론
124	CBD 방법론,Component Based Development	컴포넌트 단위의 개발/조립/유지보수를 통해 현대경영이 필요로 하는 정보시스템의 신속한 구축, 변경 확장의 용이성, 타 시스템과의 호환성을 달성하고자 하는 SW 공학 프로세스, 방법론 및 기술의 총체적 개념
125	애자일,애자일 방법론,Agile	고객의 요구사항 변화에 유연하게 대응하기 위해 일정한 주기를 반복하면서 개발하며 고객에게 시제품을 지속적으로 제공하며 고객의 요구사항이 정확하게 반영되고 있는지 점검한다. 폭포수 모형에 대비되는 유연한 방법론으로 비교적 소규모 개발 프로젝트에서 각광받고 있는 개발 방법론이다.
126	XP,eXtreme Programming	의사소통 개선과 즉각적 피드백으로 스프트웨어 품질을 높이기 위한 방법론용기, 단순성, 의사소통, 피드백, 존중을 5가지 가치로 지님.
127	스크럼,Scrum	매일 정해진 시간, 장소에서 짤은 시간의 개발을 하는 팀을 위한 프로젝트 관리 중심 방법론
128	럼바우 분석 기법,객체 모델링 기법,OMT,Object Modeling Technology	객체 지향 분석 방법 기법 중 하나로, 소프트웨어 구성 요소를 그래픽 표기법을 이용하여 모델링.
129	객체 모델링,Object Modeling	시스템에서 요구되는 객체를 찾아내어 속성과 연산 식별 및 객체들 간의 관계를 규정함. 럼바우 분석 기법에서 가장 중요하며 가장 선행되는 단계
130	동적 모델링,Dynamic Modeling	시간의 흐름에 따른 객체들 사이의 제어 흐름, 상호 작용, 동작 순서 등의 동적인 행위를 표현
131	기능 모델링,Functional Modeling	자료 흐름도(DFD)를 이용, 다수의 프로세스들 간의 자료 흐름을 중심으로 처리 과정을 표현. 어떤 데이터를 입력하면 어떤 결과를 구할 것인지 표현.
132	델파이 기법,델파이,Delphi method	전문가들의 의견수립, 중재, 타협의 방식으로 반복적인 피드백을 통한 하향식 의견 도출 방법으로 문제를 해결하는 기법으로 1964년 미국의 RAND연구소에서 개발되어 IT분야, 연구개발분야, 교육분야, 군사분야 등에서 활용되고 있다.
133	LOC,Line Of Code	원시 코드 라인수의 낙관치, 중간치, 비관치를 측정하여 예측치를 구해 비용산정
134	COCOMO,COnstructive COst MOdel	시스템의 비용을 산정하기 위해 시스템을 구성하고 있는 모듈과 서브 시스템의 비용 합계를 계산하는 방식. B.Boehm이 1981년에 초기 모델을 제안했으며, 먼저 완성될 시스템의 규모(lines of code)를 추정하고 이를 준비된 식에 대입하여 소요 인원/월을 예측함.
135	기능 점수,FP,Function Point	최종 사용자 입장에서의 기능적 복잡도를 고려하는 국제 표준(ISO/IEC 14143) 소프트웨어 규모 및 비용산정 방식
136	푸트남 모형,Putnam	개발주기의 단계별로 요구할 인력의 분포를 가정하는 방식
137	SLIM	Rayleigh-Norden곡선과 Putnam예측 모델을 기초로 하여 개발된 자동화 추정 도구
138	ESTIMACS	다양한 프로젝트와 개인별 요소를 수용하도록 FP모형을 기초로 하여 개발된 자동화 추정 도구
139	PERT,Project Evaluation and Review Technique	확률적인 추정치를 이용하여 단계중심의 확률적 모델을 전개하는 기법. 비관치, 중간치, 낙관치 이용.
140	주공정법,CPM,Critical Path Method	임계 경로를 기반으로 프로젝트의 최소 기간을 결정하는데 사용되는 일정 네트워크 분석 기법
141	중요 연쇄 프로젝트 관리,주 공정 연쇄법,CCPM,Critical Chain Project Management	작업의 선후관계 및 필요 자원의 가용성까지 고려하여 프로젝트를 계획하고 관리하는 기법
142	동료 검토,Peer Review	요구사항 명세서 작성자가 명세서 내용을 직접 설명하고 동료들이 이를 들으면서 결함을 발견
143	워크 스루,Walk Through	검토 자료를 회의 전에 배포하여 짧은 시간동안 회의를 진행하는 형태로 리뷰를 통해 오류를 검출하고 문서화
144	인스펙션,Inspection	소프트웨어 요구, 설계 원시 코드 등의 저작자 외의 다른 전무가 또는 팀이 검사하여 오류를 찾아내는 공식적 검토방법